{
    "id": "programming/temp-graph",
    "title": "Serve a live temperature graph",
    "description": "Host a simple web page that fetches your live temperature JSON endpoint and renders an auto-refreshing temperature chart.",
    "image": "/assets/quests/temperature_log_line_chart.jpg",
    "npc": "/assets/npc/orion.jpg",
    "start": "start",
    "dialogue": [
        {
            "id": "start",
            "text": "You've been logging temperatures and plotting them locally. Now let's publish a live graph that anyone on the network can open.",
            "options": [
                {
                    "type": "goto",
                    "goto": "publish",
                    "text": "Show me how.",
                    "requiresItems": [
                        {
                            "id": "f763cb7d-4e1a-4146-b304-4d8bfde4df86",
                            "count": 1
                        },
                        {
                            "id": "50360fd0-e296-4ef8-a3a9-00e049318166",
                            "count": 1
                        },
                        {
                            "id": "b6fc1ed6-f399-4fdb-9f9d-3913f893f43d",
                            "count": 1
                        }
                    ]
                }
            ]
        },
        {
            "id": "publish",
            "text": "Publish a dashboard that queries `/temp` every 30-60 seconds and renders a timestamped line chart with clear axis labels.",
            "options": [
                {
                    "type": "process",
                    "process": "publish-live-temperature-graph",
                    "text": "Publish the live dashboard"
                },
                {
                    "type": "goto",
                    "goto": "interpret",
                    "text": "Refresh checks passed and the graph stayed within 15-35°C.",
                    "requiresItems": [
                        {
                            "id": "c377a2ff-1391-4ad8-a150-1e4531067406",
                            "count": 1
                        },
                        {
                            "id": "d06c9f8d-6553-4f3c-9e10-05e1cf33a6b8",
                            "count": 1
                        }
                    ]
                },
                {
                    "type": "goto",
                    "goto": "triage",
                    "text": "Graph stuttered, froze, or showed out-of-range spikes.",
                    "requiresItems": [
                        {
                            "id": "c377a2ff-1391-4ad8-a150-1e4531067406",
                            "count": 1
                        }
                    ]
                }
            ]
        },
        {
            "id": "triage",
            "text": "Troubleshoot before sharing: check endpoint latency, browser console errors, and chart refresh interval mismatch.",
            "options": [
                {
                    "type": "goto",
                    "goto": "retest",
                    "text": "Patched refresh logic and endpoint calls; ready to re-test.",
                    "requiresItems": [
                        {
                            "id": "f763cb7d-4e1a-4146-b304-4d8bfde4df86",
                            "count": 1
                        }
                    ]
                }
            ]
        },
        {
            "id": "retest",
            "text": "Run another three refresh cycles and verify timestamps advance in order with no stale datapoints before deciding pass/fail.",
            "options": [
                {
                    "type": "process",
                    "process": "capture-hourly-temperature-log",
                    "text": "Capture validation samples"
                },
                {
                    "type": "goto",
                    "goto": "publish",
                    "text": "Retest evidence captured; evaluate bounds again.",
                    "requiresItems": [
                        {
                            "id": "d06c9f8d-6553-4f3c-9e10-05e1cf33a6b8",
                            "count": 1
                        }
                    ]
                }
            ]
        },
        {
            "id": "interpret",
            "text": "Interpret your validation log: smooth updates, plausible ranges, and no stale timestamps means the graph is reliable for monitoring.",
            "options": [
                {
                    "type": "goto",
                    "goto": "finish",
                    "text": "Interpretation complete; dashboard validated.",
                    "requiresItems": [
                        {
                            "id": "c377a2ff-1391-4ad8-a150-1e4531067406",
                            "count": 1
                        },
                        {
                            "id": "d06c9f8d-6553-4f3c-9e10-05e1cf33a6b8",
                            "count": 1
                        }
                    ]
                }
            ]
        },
        {
            "id": "finish",
            "text": "Nice work! Visualizing data makes patterns much easier to spot.",
            "options": [
                {
                    "type": "finish",
                    "text": "Looks great!"
                }
            ]
        }
    ],
    "rewards": [
        {
            "id": "b281360b-2ecc-4fea-a248-36a61c5f7399",
            "count": 1
        }
    ],
    "requiresQuests": ["programming/graph-temp-data", "programming/temp-json-api"],
    "hardening": {
        "passes": 2,
        "score": 98,
        "emoji": "✅",
        "history": [
            {
                "task": "codex-hardening-2025-12-08",
                "date": "2025-12-08",
                "score": 95
            },
            {
                "task": "codex-hardening-2025-12-18",
                "date": "2025-12-18",
                "score": 98
            }
        ]
    }
}
