{
    "id": "geothermal/compare-depth-ground-temps",
    "title": "Compare Depth Ground Temps",
    "description": "Bury two thermistors at different depths and log their readings for a day.",
    "image": "/assets/quests/geothermal_compare_depth_ground_temps.jpg",
    "npc": "/assets/npc/orion.jpg",
    "start": "start",
    "dialogue": [
        {
            "id": "start",
            "text": "Curious how ground temperature changes with depth? Let's find out.",
            "options": [
                {
                    "type": "goto",
                    "goto": "deploy",
                    "text": "How do we measure that?"
                }
            ]
        },
        {
            "id": "deploy",
            "text": "Wire two sensors using arduino-thermistor-read. Bury one shallow, one deep, and log both.",
            "options": [
                {
                    "type": "goto",
                    "goto": "finish",
                    "text": "Logs collected",
                    "process": "arduino-thermistor-read",
                    "requiresItems": [
                        {
                            "id": "72b4448e-27d9-4746-bd3a-967ff13f501b",
                            "count": 2
                        }
                    ]
                }
            ]
        },
        {
            "id": "finish",
            "text": "Awesome! Compare the logs to see how quickly the soil cools with depth.",
            "options": [
                {
                    "type": "finish",
                    "text": "Analyze data"
                }
            ]
        }
    ],
    "rewards": [
        {
            "id": "5247a603-294a-4a34-a884-1ae20969b2a1",
            "count": 1
        }
    ],
    "requiresQuests": ["geothermal/log-ground-temperature"],
    "hardening": {
        "passes": 0,
        "score": 75,
        "emoji": "🛠️",
        "history": []
    }
}
