{
    "id": "geothermal/monitor-heat-pump-energy",
    "title": "Monitor Heat Pump Energy Use",
    "description": "Capture a repeatable thermal trend log, classify anomalies, and verify corrections before closing.",
    "image": "/assets/quests/heat_pump_smart_plug_monitor.jpg",
    "npc": "/assets/npc/orion.jpg",
    "start": "start",
    "dialogue": [
        {
            "id": "start",
            "text": "Use a grounded smart plug only on the pump control load, never on high-current compressor circuits. Ready to capture a clean thermal trend trace?",
            "options": [
                {
                    "type": "goto",
                    "goto": "materials",
                    "text": "Safety check done"
                },
                {
                    "type": "goto",
                    "goto": "materials",
                    "text": "Show me the setup checklist"
                }
            ]
        },
        {
            "id": "materials",
            "text": "We need a smart plug plus logger gear so loop temperatures can be trended against relay cycling events.",
            "options": [
                {
                    "type": "grantsItems",
                    "grantsItems": [
                        {
                            "id": "a5395e29-1862-4eb7-8517-5d161635e032",
                            "count": 1
                        }
                    ],
                    "text": "Issue smart plug"
                },
                {
                    "type": "goto",
                    "goto": "capture",
                    "text": "Hardware staged",
                    "requiresItems": [
                        {
                            "id": "a5395e29-1862-4eb7-8517-5d161635e032",
                            "count": 1
                        },
                        {
                            "id": "e62dca47-fba6-4ad5-abd4-95dd41f5f4c2",
                            "count": 1
                        },
                        {
                            "id": "b6fc1ed6-f399-4fdb-9f9d-3913f893f43d",
                            "count": 1
                        }
                    ]
                }
            ]
        },
        {
            "id": "capture",
            "text": "Record at least 15 minutes of inlet/outlet temperatures with start/stop timestamps, then export the session log.",
            "options": [
                {
                    "type": "process",
                    "process": "capture-hourly-temperature-log",
                    "text": "Capture monitoring session"
                },
                {
                    "type": "goto",
                    "goto": "classify",
                    "text": "Monitoring log exported",
                    "requiresItems": [
                        {
                            "id": "d06c9f8d-6553-4f3c-9e10-05e1cf33a6b8",
                            "count": 3.0
                        }
                    ]
                }
            ]
        },
        {
            "id": "classify",
            "text": "Pass target: after warmup, inlet/outlet readings should settle into a repeatable band without rapid oscillation (>1.5°C swings every sample). Do your logs show stable trend, cycling spikes, or sustained drift?",
            "options": [
                {
                    "type": "goto",
                    "goto": "finish",
                    "text": "Stable thermal trend in-band",
                    "requiresItems": [
                        {
                            "id": "d06c9f8d-6553-4f3c-9e10-05e1cf33a6b8",
                            "count": 3.0
                        }
                    ]
                },
                {
                    "type": "goto",
                    "goto": "corrective",
                    "text": "Anomaly detected (spike or drift)"
                }
            ]
        },
        {
            "id": "corrective",
            "text": "Corrective branch: check filter clog, trapped loop air, and stuck circulator speed. Apply one fix, then run another 15-minute log before closing.",
            "options": [
                {
                    "type": "goto",
                    "goto": "capture",
                    "text": "Applied fix, rerun monitoring"
                },
                {
                    "type": "goto",
                    "goto": "start",
                    "text": "Stop and re-check electrical safety"
                }
            ]
        },
        {
            "id": "finish",
            "text": "Nice work. Store this baseline with outdoor conditions so seasonal efficiency drops are obvious.",
            "options": [
                {
                    "type": "finish",
                    "text": "Energy monitoring baseline complete",
                    "requiresItems": [
                        {
                            "id": "d06c9f8d-6553-4f3c-9e10-05e1cf33a6b8",
                            "count": 1
                        }
                    ]
                }
            ]
        }
    ],
    "rewards": [
        {
            "id": "061fd221-404a-4bd1-9432-3e25b0f17a2c",
            "count": 1
        }
    ],
    "requiresQuests": [
        "geothermal/log-ground-temperature"
    ],
    "hardening": {
        "passes": 0,
        "score": 95,
        "emoji": "🛠️",
        "history": []
    }
}
