{
    "id": "sysadmin/basic-commands",
    "title": "Learn Basic Linux Commands",
    "description": "Practice core shell commands on an Ubuntu 24.04 LTS node and generate your first command artifacts.",
    "image": "/assets/quests/linux_basic_shell_commands.jpg",
    "npc": "/assets/npc/orion.jpg",
    "start": "start",
    "dialogue": [
        {
            "id": "start",
            "text": "Ubuntu 24.04 LTS Minimal is rock solid in 2030. We'll start on your laptop shell, then turn command output into mission records.",
            "options": [
                {
                    "type": "goto",
                    "goto": "prep",
                    "text": "Let's begin command drills"
                }
            ]
        },
        {
            "id": "prep",
            "text": "Run this first process to generate a shell transcript file (for example: commands-output.txt with pwd, ls -la, grep, awk, and sed examples).",
            "options": [
                {
                    "type": "process",
                    "process": "sysadmin-basic-generate-shell-transcript",
                    "text": "Create shell transcript artifact"
                },
                {
                    "type": "goto",
                    "goto": "parse",
                    "text": "Transcript generated"
                }
            ]
        },
        {
            "id": "parse",
            "text": "Great. Now summarize your command results into a compact cheatsheet so another operator can reproduce your workflow.",
            "options": [
                {
                    "type": "process",
                    "process": "sysadmin-basic-compile-command-cheatsheet",
                    "text": "Build command cheatsheet"
                },
                {
                    "type": "goto",
                    "goto": "quiz-1",
                    "text": "Cheatsheet complete"
                }
            ]
        },
        {
            "id": "quiz-1",
            "text": "Which command prints your current working directory?",
            "options": [
                {
                    "type": "goto",
                    "goto": "quiz-2",
                    "text": "pwd"
                },
                {
                    "type": "goto",
                    "goto": "retry-1",
                    "text": "ps"
                },
                {
                    "type": "goto",
                    "goto": "retry-1",
                    "text": "df"
                }
            ]
        },
        {
            "id": "quiz-2",
            "text": "Which command lists files, including hidden ones, in long format?",
            "options": [
                {
                    "type": "goto",
                    "goto": "quiz-3",
                    "text": "ls -la"
                },
                {
                    "type": "goto",
                    "goto": "retry-2",
                    "text": "cd -la"
                },
                {
                    "type": "goto",
                    "goto": "retry-2",
                    "text": "mkdir -la"
                }
            ]
        },
        {
            "id": "quiz-3",
            "text": "What does grep primarily do?",
            "options": [
                {
                    "type": "goto",
                    "goto": "quiz-4",
                    "text": "Searches text for matching patterns"
                },
                {
                    "type": "goto",
                    "goto": "retry-3",
                    "text": "Changes file ownership"
                },
                {
                    "type": "goto",
                    "goto": "retry-3",
                    "text": "Monitors CPU temperature"
                }
            ]
        },
        {
            "id": "quiz-4",
            "text": "Which tool is best for quick column extraction from structured text?",
            "options": [
                {
                    "type": "goto",
                    "goto": "quiz-5",
                    "text": "awk"
                },
                {
                    "type": "goto",
                    "goto": "retry-4",
                    "text": "echo"
                },
                {
                    "type": "goto",
                    "goto": "retry-4",
                    "text": "whoami"
                }
            ]
        },
        {
            "id": "quiz-5",
            "text": "You need to replace text inline in a stream. Which command is designed for that?",
            "options": [
                {
                    "type": "goto",
                    "goto": "finish",
                    "text": "sed"
                },
                {
                    "type": "goto",
                    "goto": "retry-5",
                    "text": "cat"
                },
                {
                    "type": "goto",
                    "goto": "retry-5",
                    "text": "uname"
                }
            ]
        },
        {
            "id": "retry-1",
            "text": "Not quite. pwd reveals where you are in the filesystem.",
            "options": [
                {
                    "type": "goto",
                    "goto": "quiz-1",
                    "text": "Try question again"
                }
            ]
        },
        {
            "id": "retry-2",
            "text": "Close. ls -la combines long listing with hidden files.",
            "options": [
                {
                    "type": "goto",
                    "goto": "quiz-2",
                    "text": "Try question again"
                }
            ]
        },
        {
            "id": "retry-3",
            "text": "grep is your pattern scanner. It's one of the fastest ways to find signal in logs.",
            "options": [
                {
                    "type": "goto",
                    "goto": "quiz-3",
                    "text": "Try question again"
                }
            ]
        },
        {
            "id": "retry-4",
            "text": "awk is built for field-focused extraction and quick reporting.",
            "options": [
                {
                    "type": "goto",
                    "goto": "quiz-4",
                    "text": "Try question again"
                }
            ]
        },
        {
            "id": "retry-5",
            "text": "sed handles stream edits and substitutions like a champ.",
            "options": [
                {
                    "type": "goto",
                    "goto": "quiz-5",
                    "text": "Try question again"
                }
            ]
        },
        {
            "id": "finish",
            "text": "Excellent. Bring your transcript and cheatsheet to close the mission.",
            "options": [
                {
                    "type": "finish",
                    "text": "Mission complete",
                    "requiresItems": [
                        {
                            "id": "91923542-45d5-46f5-82eb-6367b26ef8cc",
                            "count": 1
                        },
                        {
                            "id": "f17410cd-8c38-4612-9666-7bd1c399874d",
                            "count": 1
                        }
                    ]
                }
            ]
        }
    ],
    "rewards": [
        {
            "id": "d2b39a23-cdfb-428d-a6ed-694ff0c0fc11",
            "count": 1
        }
    ],
    "requiresQuests": [
        "welcome/howtodoquests"
    ],
    "hardening": {
        "passes": 0,
        "score": 100,
        "emoji": "🛠️",
        "history": []
    }
}
