{
    "id": "programming/graph-temp",
    "title": "Graph Temperature Logs",
    "description": "Plot the raw log from temp-logger to get a quick visual check that your sensor data looks reasonable.",
    "image": "/assets/quests/programming_graph_temperature_data.jpg",
    "npc": "/assets/npc/dChat.jpg",
    "start": "start",
    "dialogue": [
        {
            "id": "start",
            "text": "Now that you've been collecting temperature readings, let's turn that list of numbers into a chart. Visualization makes trends easy to spot.",
            "options": [
                {
                    "type": "goto",
                    "goto": "prep",
                    "text": "Let's create a graph.",
                    "requiresItems": [
                        {
                            "id": "d06c9f8d-6553-4f3c-9e10-05e1cf33a6b8",
                            "count": 1
                        }
                    ]
                }
            ]
        },
        {
            "id": "prep",
            "text": "Point your plotting script at the CSV from your logger. Even a quick CLI run beats eyeballing raw numbers.",
            "options": [
                {
                    "type": "process",
                    "process": "plot-temperature-data",
                    "text": "Run the plotting script"
                },
                {
                    "type": "goto",
                    "goto": "finish",
                    "text": "My chart looks great!",
                    "requiresItems": [
                        {
                            "id": "e7d1cd7d-e014-43a1-b1c8-9b7fb39deeed",
                            "count": 1
                        }
                    ]
                }
            ]
        },
        {
            "id": "finish",
            "text": "Excellent work! Graphing your sensor data opens the door to more advanced analytics down the road.",
            "options": [
                {
                    "type": "finish",
                    "text": "Thanks dChat!"
                }
            ]
        }
    ],
    "rewards": [
        {
            "id": "d06c9f8d-6553-4f3c-9e10-05e1cf33a6b8",
            "count": 1
        }
    ],
    "requiresQuests": ["programming/temp-logger"],
    "hardening": {
        "passes": 2,
        "score": 100,
        "emoji": "✅",
        "history": [
            {
                "task": "codex-hardening-2025-12-08",
                "date": "2025-12-08",
                "score": 95
            },
            {
                "task": "codex-hardening-2025-12-18",
                "date": "2025-12-18",
                "score": 98
            }
        ]
    }
}
